[
  {
    "conclusion_id": "con_0001",
    "topic": "loading",
    "research_question": "What repetition ranges can produce hypertrophy?",
    "male_population": "healthy adult natural males",
    "training_status": "all",
    "nutrition_context": "all",
    "conclusion": "A broad loading spectrum can produce hypertrophy when sets are sufficiently effortful; moderate loads are usually the most time-efficient default.",
    "recommended_lower_bound": 5,
    "recommended_upper_bound": 30,
    "recommended_unit": "repetitions",
    "practical_range_text": "Approximately 5-30 reps; 6-15 is the practical default for many exercises",
    "supporting_study_ids": "stu_0004|stu_0039",
    "conflicting_study_ids": "",
    "direct_or_indirect_evidence": "mixed",
    "evidence_strength": "high",
    "confidence_rating": "high",
    "key_limitations": "Most syntheses combine sexes and training statuses; exercise- and muscle-specific data are sparse.",
    "application_rule": "A broad loading spectrum can produce hypertrophy when sets are sufficiently effortful; moderate loads are usually the most time-efficient default.",
    "exceptions": "Pain, technique failure, medical contraindications, or recovery failure override the default.",
    "last_reviewed_date": "2026-07-12"
  },
  {
    "conclusion_id": "con_0002",
    "topic": "loading",
    "research_question": "How should effort change with load?",
    "male_population": "healthy adult natural males",
    "training_status": "all",
    "nutrition_context": "all",
    "conclusion": "As loads become lighter and rep targets rise, sets generally need to finish closer to task failure to recruit and fatigue high-threshold motor units.",
    "recommended_lower_bound": 0,
    "recommended_upper_bound": 3,
    "recommended_unit": "rir",
    "practical_range_text": "Heavy/moderate: often 1-4 RIR; light/high-rep: often 0-2 RIR",
    "supporting_study_ids": "stu_0005|stu_0006",
    "conflicting_study_ids": "",
    "direct_or_indirect_evidence": "mixed",
    "evidence_strength": "moderate",
    "confidence_rating": "moderate",
    "key_limitations": "Most syntheses combine sexes and training statuses; exercise- and muscle-specific data are sparse.",
    "application_rule": "As loads become lighter and rep targets rise, sets generally need to finish closer to task failure to recruit and fatigue high-threshold motor units.",
    "exceptions": "Pain, technique failure, medical contraindications, or recovery failure override the default.",
    "last_reviewed_date": "2026-07-12"
  },
  {
    "conclusion_id": "con_0003",
    "topic": "failure",
    "research_question": "Is momentary failure required?",
    "male_population": "healthy adult natural males",
    "training_status": "all",
    "nutrition_context": "all",
    "conclusion": "Momentary muscular failure is not required for hypertrophy and can impose extra fatigue; it is more defensible selectively on stable isolation work than routinely on high-skill compounds.",
    "recommended_lower_bound": 0,
    "recommended_upper_bound": 4,
    "recommended_unit": "rir",
    "practical_range_text": "0-4 rir",
    "supporting_study_ids": "stu_0005|stu_0006",
    "conflicting_study_ids": "",
    "direct_or_indirect_evidence": "mixed",
    "evidence_strength": "moderate",
    "confidence_rating": "moderate",
    "key_limitations": "Most syntheses combine sexes and training statuses; exercise- and muscle-specific data are sparse.",
    "application_rule": "Momentary muscular failure is not required for hypertrophy and can impose extra fatigue; it is more defensible selectively on stable isolation work than routinely on high-skill compounds.",
    "exceptions": "Pain, technique failure, medical contraindications, or recovery failure override the default.",
    "last_reviewed_date": "2026-07-12"
  },
  {
    "conclusion_id": "con_0004",
    "topic": "volume",
    "research_question": "How does weekly set volume affect hypertrophy?",
    "male_population": "healthy adult males eligible for resistance training",
    "training_status": "all",
    "nutrition_context": "all",
    "conclusion": "Hypertrophy generally increases with weekly set volume, but marginal returns diminish and individual recovery constrains useful dose.",
    "recommended_lower_bound": 4,
    "recommended_upper_bound": 20,
    "recommended_unit": "fractional_hard_sets_per_muscle_per_week",
    "practical_range_text": "Start near 6-10 fractional hard sets; many trained males use roughly 10-20, adjusted by response",
    "supporting_study_ids": "stu_0001|stu_0002|stu_0025",
    "conflicting_study_ids": "",
    "direct_or_indirect_evidence": "mixed",
    "evidence_strength": "high",
    "confidence_rating": "moderate",
    "key_limitations": "The numeric bands are operational starting ranges, not established per-muscle thresholds.",
    "application_rule": "Hypertrophy generally increases with weekly set volume, but marginal returns diminish and individual recovery constrains useful dose.",
    "exceptions": "Pain, technique failure, medical contraindications, or recovery failure override the default.",
    "last_reviewed_date": "2026-07-12"
  },
  {
    "conclusion_id": "con_0005",
    "topic": "volume",
    "research_question": "How should indirect sets be counted?",
    "male_population": "healthy adult natural males",
    "training_status": "all",
    "nutrition_context": "all",
    "conclusion": "Fractional counting is more defensible than either ignoring all indirect work or crediting every indirect set as a full direct set.",
    "recommended_lower_bound": 0.5,
    "recommended_upper_bound": 0.5,
    "recommended_unit": "fractional_set_credit_default",
    "practical_range_text": "Default 0.5 for a clearly loaded secondary mover; use 0-1 when exercise-specific evidence or technique warrants",
    "supporting_study_ids": "stu_0001",
    "conflicting_study_ids": "",
    "direct_or_indirect_evidence": "expert_inference",
    "evidence_strength": "low",
    "confidence_rating": "low",
    "key_limitations": "Most syntheses combine sexes and training statuses; exercise- and muscle-specific data are sparse.",
    "application_rule": "Fractional counting is more defensible than either ignoring all indirect work or crediting every indirect set as a full direct set.",
    "exceptions": "Pain, technique failure, medical contraindications, or recovery failure override the default.",
    "last_reviewed_date": "2026-07-12"
  },
  {
    "conclusion_id": "con_0006",
    "topic": "frequency",
    "research_question": "How often should a muscle be trained?",
    "male_population": "healthy adult natural males",
    "training_status": "all",
    "nutrition_context": "all",
    "conclusion": "Frequency is mainly a way to distribute weekly volume and preserve set quality; when volume is equated, hypertrophy differences are small.",
    "recommended_lower_bound": 1,
    "recommended_upper_bound": 3,
    "recommended_unit": "sessions_per_muscle_per_week",
    "practical_range_text": "1-3 sessions per muscle weekly; 2 is a convenient default",
    "supporting_study_ids": "stu_0001|stu_0003",
    "conflicting_study_ids": "",
    "direct_or_indirect_evidence": "mixed",
    "evidence_strength": "high",
    "confidence_rating": "high",
    "key_limitations": "Most syntheses combine sexes and training statuses; exercise- and muscle-specific data are sparse.",
    "application_rule": "Frequency is mainly a way to distribute weekly volume and preserve set quality; when volume is equated, hypertrophy differences are small.",
    "exceptions": "Pain, technique failure, medical contraindications, or recovery failure override the default.",
    "last_reviewed_date": "2026-07-12"
  },
  {
    "conclusion_id": "con_0007",
    "topic": "session_volume",
    "research_question": "How many hard sets should be performed per muscle in one session?",
    "male_population": "trained adult natural males",
    "training_status": "all",
    "nutrition_context": "all",
    "conclusion": "Spread large weekly volumes across sessions when per-session set quality, repetitions, or target-muscle limitation deteriorates.",
    "recommended_lower_bound": 2,
    "recommended_upper_bound": 8,
    "recommended_unit": "fractional_hard_sets_per_muscle_per_session",
    "practical_range_text": "2-8 fractional_hard_sets_per_muscle_per_session",
    "supporting_study_ids": "stu_0001|stu_0003",
    "conflicting_study_ids": "",
    "direct_or_indirect_evidence": "expert_inference",
    "evidence_strength": "low",
    "confidence_rating": "low",
    "key_limitations": "No validated universal per-session hypertrophy cap exists.",
    "application_rule": "Spread large weekly volumes across sessions when per-session set quality, repetitions, or target-muscle limitation deteriorates.",
    "exceptions": "Pain, technique failure, medical contraindications, or recovery failure override the default.",
    "last_reviewed_date": "2026-07-12"
  },
  {
    "conclusion_id": "con_0008",
    "topic": "rest",
    "research_question": "How long should rest intervals be?",
    "male_population": "healthy adult natural males",
    "training_status": "all",
    "nutrition_context": "all",
    "conclusion": "Rest long enough to preserve intended repetitions, load, range of motion, and target-muscle performance; compounds usually need longer rests than isolations.",
    "recommended_lower_bound": 60,
    "recommended_upper_bound": 300,
    "recommended_unit": "seconds",
    "practical_range_text": "About 2-5 min for demanding compounds and 1-3 min for stable isolations",
    "supporting_study_ids": "stu_0007|stu_0026|stu_0038",
    "conflicting_study_ids": "",
    "direct_or_indirect_evidence": "mixed",
    "evidence_strength": "moderate",
    "confidence_rating": "moderate",
    "key_limitations": "Most syntheses combine sexes and training statuses; exercise- and muscle-specific data are sparse.",